{
  "_type": "https://in-toto.io/Statement/v1",
  "subject": [
    {
      "name": "example-software-artifact",
      "digest": { "sha256": "a1b2c3d4e5f6..." }
    }
  ],
  "predicateType": "https://in-toto.io/attestation/scai/attribute-report/v0.2",
  "predicate": {
    "attributes": [
      {
        "attribute": "PASSED_DEVELOPMENT_ENVIRONMENT",
        "evidence": {
          "name": "a1b2c3d4e5f6.development.jsonl",
          "uri": "https://example.com/scai/a1b2c3d4e5f6.development.jsonl",
          "digest": { "sha256": "d1e2f3a4b5c6..." },
          "mediaType": "application/x.dsse+json"
        }
      },
      {
        "attribute": "PASSED_SOURCE",
        "evidence": {
          "name": "a1b2c3d4e5f6.source.jsonl",
          "uri": "https://example.com/scai/a1b2c3d4e5f6.source.jsonl",
          "digest": { "sha256": "e2f3a4b5c6d1..." },
          "mediaType": "application/x.dsse+json"
        }
      },
      {
        "attribute": "PASSED_BUILD",
        "evidence": {
          "name": "a1b2c3d4e5f6.build.jsonl",
          "uri": "https://example.com/scai/a1b2c3d4e5f6.build.jsonl",
          "digest": { "sha256": "f3a4b5c6d1e2..." },
          "mediaType": "application/x.dsse+json"
        }
      },
      {
        "attribute": "PASSED_PACKAGE",
        "evidence": {
          "name": "a1b2c3d4e5f6.package.jsonl",
          "uri": "https://example.com/scai/a1b2c3d4e5f6.package.jsonl",
          "digest": { "sha256": "a4b5c6d1e2f3..." },
          "mediaType": "application/x.dsse+json"
        }
      },
      {
        "attribute": "PASSED_DEPLOY",
        "evidence": {
          "name": "a1b2c3d4e5f6.deploy.jsonl",
          "uri": "https://example.com/scai/a1b2c3d4e5f6.deploy.jsonl",
          "digest": { "sha256": "b5c6d1e2f3a4..." },
          "mediaType": "application/x.dsse+json"
        }
      }
    ],
    "producer": {
      "uri": "https://example.com/gatekeeping-attestor",
      "name": "Gatekeeping Attestor",
      "digest": {
        "sha256": "0123456789abcdef..."
      }
    }
  }
}
